{
  "artifacts": [
    {
      "bytes": 10127,
      "missing": false,
      "path": "docs/theory/theorem_ledger.md",
      "sha256": "a8ed8bb949c97ad2a157654e7121f0d8150ce65f876a94ef6577b8b185a3ae20"
    },
    {
      "bytes": 33874,
      "missing": false,
      "path": "src/cc/kernel/sensitivity.py",
      "sha256": "6ff24bf54969a046c774c8b3ab251de31fbb4c0d505db88a9b4b283aea562422"
    },
    {
      "bytes": 7346,
      "missing": false,
      "path": "docs/api.md",
      "sha256": "34db452fa048483afc06caaf7806703b53ea984e6625d681a31b35db11d71c33"
    }
  ],
  "assumptions": [
    "The constraint set defines a nonempty feasible polytope.",
    "Constraints and the query are linear in the atom probabilities.",
    "The LP solver reports optimal status rather than a tolerance-limited stop."
  ],
  "card_id": "kernel.identified_interval",
  "claim": "The finite atom LP computes sharp lower and upper values for declared linear composition queries over feasible finite binary atom distributions.",
  "command": [
    "pytest tests/unit/kernel/test_sensitivity.py",
    "pytest tests/unit/kernel/test_monotonic_tightening.py",
    "make test-kernel"
  ],
  "counterevidence": [],
  "falsifier": "A feasible atom distribution whose query value falls outside the reported interval, or a value strictly inside the interval attained by no feasible distribution.",
  "label_meanings": {
    "evidence_state": "Produced on a local machine. Says nothing about cloud or deployed behaviour.",
    "publication_state": "Not yet reviewed for publication.",
    "verdict": "The command has not been executed for this card. No result is claimed."
  },
  "labels": {
    "evidence_state": "local-only",
    "publication_state": "draft",
    "verdict": "not-run"
  },
  "maturity": "C3",
  "non_claims": [
    "Does not validate upstream data collection.",
    "Does not validate semantic safety.",
    "Does not establish representativeness."
  ],
  "result_detail": null,
  "retraction_reason": null,
  "schema_version": "cc.evidence_card.v1",
  "source_revision": "1fb366f417f4d5dd2ae3786b524efa0c4befbc7d",
  "supersedes": null
}
