{
  "artifacts": [
    {
      "bytes": 26986,
      "missing": false,
      "path": "README.md",
      "sha256": "6deedf9f9f9ee612651da1667742408c2d5106c83475e45b5336e79bc73f0dfe"
    },
    {
      "bytes": 8366,
      "missing": false,
      "path": "docs/validation_matrix.md",
      "sha256": "5a6ac30c8a81ba1a08e46a52251c55cb0f0936a236b07b3bf9c8a273cc91f776"
    },
    {
      "bytes": 10127,
      "missing": false,
      "path": "docs/theory/theorem_ledger.md",
      "sha256": "a8ed8bb949c97ad2a157654e7121f0d8150ce65f876a94ef6577b8b185a3ae20"
    },
    {
      "bytes": 4687,
      "missing": false,
      "path": "docs/briefs/rick_mergenthaler_ai_safety_disclosure_controls.md",
      "sha256": "65240508d532ad7467aa4c2c14b67ae32a1acd68a3b21c5b6f37dd8984536b2f"
    },
    {
      "bytes": 2437,
      "missing": false,
      "path": "docs/briefs/three_minute_demo.md",
      "sha256": "ef4ae474b3fe93aa1aa0b5d02a3ea58fda616da30b4a47c7a640a84fa115bd40"
    },
    {
      "bytes": 7225,
      "missing": false,
      "path": "docs/research/NON_CLAIMS.md",
      "sha256": "8ba6e6a27c445a282b07d1ba704544382570b2c7285f4f73238dec7658428627"
    }
  ],
  "assumptions": [
    "The producer declares evidence roles honestly; the verifier checks structure, not sincerity.",
    "The v0 non-claims engine detects the intended substance rather than only exact strings."
  ],
  "card_id": "evidence.non_claim_boundaries",
  "claim": "Documentation and reporting surfaces explicitly separate what each validation result supports from what it does not support.",
  "command": [
    ".venv/bin/mkdocs build --strict",
    "PYTHONPATH=src .venv/bin/python -m pytest -q tests/unit/evidence",
    "PYTHONPATH=src .venv/bin/python -m pytest -q tests/integration/test_claim_governance_capsule.py"
  ],
  "counterevidence": [],
  "falsifier": "An evidence-bound claim package that passes verify-claim-governance while omitting a non-claim its declared evidence roles require.",
  "label_meanings": {
    "evidence_state": "Produced on a local machine. Says nothing about cloud or deployed behaviour.",
    "publication_state": "Not yet reviewed for publication.",
    "verdict": "The command has not been executed for this card. No result is claimed."
  },
  "labels": {
    "evidence_state": "local-only",
    "publication_state": "draft",
    "verdict": "not-run"
  },
  "maturity": "C4",
  "non_claims": [
    "Does not prevent bad-faith actors from making misleading claims outside the framework."
  ],
  "result_detail": null,
  "retraction_reason": null,
  "schema_version": "cc.evidence_card.v1",
  "source_revision": "1fb366f417f4d5dd2ae3786b524efa0c4befbc7d",
  "supersedes": null
}
